[
  {
    "schemaVersion": 1,
    "attemptId": "sample-code-graph:G1:1",
    "runId": "sample-code-graph",
    "taskId": "G1",
    "taskTitle": "Reject negative refund amounts",
    "attempt": 1,
    "size": "small",
    "tier": "cheap",
    "model": "sample-model",
    "harness": "sample",
    "sessionId": null,
    "branch": null,
    "tokens": {
      "uncachedInput": 1000,
      "cachedInput": 0,
      "output": 500,
      "total": 1500
    },
    "estimatedCostNanos": 200000000,
    "costSource": "simulated",
    "ceilingNanos": 200000000,
    "result": "passed",
    "resultReason": null,
    "escalatedFrom": null,
    "handoff": "none",
    "prUrl": null,
    "traceId": null,
    "traceUrl": null,
    "checkpointId": null,
    "checkpointUrl": null,
    "decision": "Sized from the labelled sample code-graph slice.",
    "startedAt": "2026-10-11T03:00:00Z",
    "endedAt": "2026-10-11T03:00:12Z"
  },
  {
    "schemaVersion": 1,
    "attemptId": "sample-code-graph:G2:1",
    "runId": "sample-code-graph",
    "taskId": "G2",
    "taskTitle": "Make repeated charges idempotent",
    "attempt": 1,
    "size": "medium",
    "tier": "cheap",
    "model": "sample-model",
    "harness": "sample",
    "sessionId": null,
    "branch": null,
    "tokens": {
      "uncachedInput": 1000,
      "cachedInput": 0,
      "output": 500,
      "total": 1500
    },
    "estimatedCostNanos": 200000000,
    "costSource": "simulated",
    "ceilingNanos": 200000000,
    "result": "stopped",
    "resultReason": "Stopped at the ceiling",
    "escalatedFrom": null,
    "handoff": "none",
    "prUrl": null,
    "traceId": null,
    "traceUrl": null,
    "checkpointId": null,
    "checkpointUrl": null,
    "decision": "Sized from the labelled sample code-graph slice.",
    "startedAt": "2026-10-11T03:00:10Z",
    "endedAt": "2026-10-11T03:00:25Z"
  },
  {
    "schemaVersion": 1,
    "attemptId": "sample-code-graph:G2:2",
    "runId": "sample-code-graph",
    "taskId": "G2",
    "taskTitle": "Make repeated charges idempotent",
    "attempt": 2,
    "size": "medium",
    "tier": "middle",
    "model": "sample-model",
    "harness": "sample",
    "sessionId": null,
    "branch": null,
    "tokens": {
      "uncachedInput": 1000,
      "cachedInput": 0,
      "output": 500,
      "total": 1500
    },
    "estimatedCostNanos": 200000000,
    "costSource": "simulated",
    "ceilingNanos": 200000000,
    "result": "passed",
    "resultReason": null,
    "escalatedFrom": "sample-code-graph:G2:1",
    "handoff": "restart",
    "prUrl": null,
    "traceId": null,
    "traceUrl": null,
    "checkpointId": null,
    "checkpointUrl": null,
    "decision": "Sized from the labelled sample code-graph slice.",
    "startedAt": "2026-10-11T03:00:26Z",
    "endedAt": "2026-10-11T03:00:50Z"
  },
  {
    "schemaVersion": 1,
    "attemptId": "sample-code-graph:G3:1",
    "runId": "sample-code-graph",
    "taskId": "G3",
    "taskTitle": "Change the shared ledger transaction boundary",
    "attempt": 1,
    "size": "large",
    "tier": "cheap",
    "model": "sample-model",
    "harness": "sample",
    "sessionId": null,
    "branch": null,
    "tokens": {
      "uncachedInput": 1000,
      "cachedInput": 0,
      "output": 500,
      "total": 1500
    },
    "estimatedCostNanos": 200000000,
    "costSource": "simulated",
    "ceilingNanos": 200000000,
    "result": "failed",
    "resultReason": "Pass check failed",
    "escalatedFrom": null,
    "handoff": "none",
    "prUrl": null,
    "traceId": null,
    "traceUrl": null,
    "checkpointId": null,
    "checkpointUrl": null,
    "decision": "Sized from the labelled sample code-graph slice.",
    "startedAt": "2026-10-11T03:00:15Z",
    "endedAt": "2026-10-11T03:00:59Z"
  }
]
