[
  {
    "schemaVersion": 1,
    "attemptId": "run-20261011-0830:T1:1",
    "runId": "run-20261011-0830",
    "taskId": "T1",
    "taskTitle": "Reject negative amounts in refund validator",
    "attempt": 1,
    "size": "small",
    "tier": "cheap",
    "model": "claude-haiku-4-5-20251001",
    "harness": "claude-code",
    "sessionId": "payments-service-41",
    "entireSessionId": "fixture-codex-session-41",
    "branch": "tally/run-20261011-0830/t1",
    "tokens": {
      "uncachedInput": 60000,
      "cachedInput": 400000,
      "output": 6000,
      "total": 466000
    },
    "estimatedCostNanos": 130000000,
    "costSource": "list-price",
    "ceilingNanos": 300000000,
    "result": "passed",
    "resultReason": null,
    "escalatedFrom": null,
    "handoff": "none",
    "prUrl": "https://github.com/acme/payments-service/pull/31",
    "traceUrl": null,
    "checkpointId": "248e067d248e",
    "checkpointUrl": "https://entire.io/gh/acme/payments-service/checkpoints/248e067d248e",
    "decision": "Small change in one file with an existing test file beside it, so the cheap tier is expected to finish under its $0.30 ceiling.",
    "startedAt": "2026-10-11T03:00:00Z",
    "endedAt": "2026-10-11T03:04:00Z",
    "traceId": "56e27d5956e31b9056e3b9c756e457fe"
  },
  {
    "schemaVersion": 1,
    "attemptId": "run-20261011-0830:T2:1",
    "runId": "run-20261011-0830",
    "taskId": "T2",
    "taskTitle": "Add currency code to receipt export",
    "attempt": 1,
    "size": "small",
    "tier": "cheap",
    "model": "claude-haiku-4-5-20251001",
    "harness": "claude-code",
    "sessionId": "payments-service-42",
    "branch": "tally/run-20261011-0830/t2",
    "tokens": {
      "uncachedInput": 80000,
      "cachedInput": 600000,
      "output": 9000,
      "total": 689000
    },
    "estimatedCostNanos": 185000000,
    "costSource": "list-price",
    "ceilingNanos": 300000000,
    "result": "passed",
    "resultReason": null,
    "escalatedFrom": null,
    "handoff": "none",
    "prUrl": "https://github.com/acme/payments-service/pull/32",
    "traceUrl": null,
    "checkpointId": "c2c5802ec2c6",
    "checkpointUrl": "https://entire.io/gh/acme/payments-service/checkpoints/c2c5802ec2c6",
    "decision": "Two files touched and no dependents outside the export module; cheap tier, with $39.87 of budget left.",
    "startedAt": "2026-10-11T03:00:00Z",
    "endedAt": "2026-10-11T03:06:00Z",
    "traceId": "f519f70af51a9541f51b3378f51bd1af"
  },
  {
    "schemaVersion": 1,
    "attemptId": "run-20261011-0830:T3:1",
    "runId": "run-20261011-0830",
    "taskId": "T3",
    "taskTitle": "Fix timezone in settlement date formatter",
    "attempt": 1,
    "size": "small",
    "tier": "cheap",
    "model": "claude-haiku-4-5-20251001",
    "harness": "claude-code",
    "sessionId": "payments-service-43",
    "branch": "tally/run-20261011-0830/t3",
    "tokens": {
      "uncachedInput": 45000,
      "cachedInput": 300000,
      "output": 5000,
      "total": 350000
    },
    "estimatedCostNanos": 100000000,
    "costSource": "list-price",
    "ceilingNanos": 300000000,
    "result": "passed",
    "resultReason": null,
    "escalatedFrom": null,
    "handoff": "none",
    "prUrl": "https://github.com/acme/payments-service/pull/33",
    "traceUrl": null,
    "checkpointId": "60fcf9df60fd",
    "checkpointUrl": "https://entire.io/gh/acme/payments-service/checkpoints/60fcf9df60fd",
    "decision": "Single function with tests already covering it; the issue names the exact failing case, so cheap is the lowest-cost route.",
    "startedAt": "2026-10-11T03:00:00Z",
    "endedAt": "2026-10-11T03:03:00Z",
    "traceId": "935170bb93520ef29352ad2993534b60"
  },
  {
    "schemaVersion": 1,
    "attemptId": "run-20261011-0830:T4:1",
    "runId": "run-20261011-0830",
    "taskId": "T4",
    "taskTitle": "Retry webhook delivery with backoff",
    "attempt": 1,
    "size": "medium",
    "tier": "middle",
    "model": "claude-sonnet-5-5",
    "harness": "claude-code",
    "sessionId": "payments-service-44",
    "branch": "tally/run-20261011-0830/t4",
    "tokens": {
      "uncachedInput": 150000,
      "cachedInput": 1800000,
      "output": 22000,
      "total": 1972000
    },
    "estimatedCostNanos": 880000000,
    "costSource": "list-price",
    "ceilingNanos": 2000000000,
    "result": "passed",
    "resultReason": null,
    "escalatedFrom": null,
    "handoff": "none",
    "prUrl": "https://github.com/acme/payments-service/pull/34",
    "traceUrl": null,
    "checkpointId": "ff347390ff35",
    "checkpointUrl": "https://entire.io/gh/acme/payments-service/checkpoints/ff347390ff35",
    "decision": "Medium task touching the delivery queue, which has 9 callers and no tests; too uncertain for cheap, so it starts on the middle tier.",
    "startedAt": "2026-10-11T03:04:00Z",
    "endedAt": "2026-10-11T03:15:00Z",
    "traceId": "3188ea6c318988a3318a26da318ac511"
  },
  {
    "schemaVersion": 1,
    "attemptId": "run-20261011-0830:T5:1",
    "runId": "run-20261011-0830",
    "taskId": "T5",
    "taskTitle": "Idempotency keys for the charge endpoint",
    "attempt": 1,
    "size": "medium",
    "tier": "cheap",
    "model": "claude-haiku-4-5-20251001",
    "harness": "claude-code",
    "sessionId": "payments-service-45",
    "branch": "tally/run-20261011-0830/t5",
    "tokens": {
      "uncachedInput": 310000,
      "cachedInput": 2600000,
      "output": 48000,
      "total": 2958000
    },
    "estimatedCostNanos": 810000000,
    "costSource": "list-price",
    "ceilingNanos": 800000000,
    "result": "stopped",
    "resultReason": "ceiling crossed: $0.81 spent against a $0.80 ceiling, tests still failing",
    "escalatedFrom": null,
    "handoff": "none",
    "prUrl": null,
    "traceUrl": null,
    "checkpointId": "9d6bed419d6c",
    "checkpointUrl": "https://entire.io/gh/acme/payments-service/checkpoints/9d6bed419d6c",
    "decision": "Looks contained to one handler with tests present, so a cheap attempt capped at $0.80 costs less in expectation than going straight to middle.",
    "startedAt": "2026-10-11T03:06:00Z",
    "endedAt": "2026-10-11T03:19:00Z",
    "traceId": "cfc0641dcfc10254cfc1a08bcfc23ec2"
  },
  {
    "schemaVersion": 1,
    "attemptId": "run-20261011-0830:T6:1",
    "runId": "run-20261011-0830",
    "taskId": "T6",
    "taskTitle": "Paginate the transactions list API",
    "attempt": 1,
    "size": "medium",
    "tier": "middle",
    "model": "claude-sonnet-5-5",
    "harness": "claude-code",
    "sessionId": "payments-service-47",
    "branch": "tally/run-20261011-0830/t6",
    "tokens": {
      "uncachedInput": 180000,
      "cachedInput": 2200000,
      "output": 30000,
      "total": 2410000
    },
    "estimatedCostNanos": 1100000000,
    "costSource": "list-price",
    "ceilingNanos": 2000000000,
    "result": "passed",
    "resultReason": null,
    "escalatedFrom": null,
    "handoff": "none",
    "prUrl": "https://github.com/acme/payments-service/pull/36",
    "traceUrl": null,
    "checkpointId": "d9dae0a3d9db",
    "checkpointUrl": "https://entire.io/gh/acme/payments-service/checkpoints/d9dae0a3d9db",
    "decision": "Medium task across the route, the query layer and the client types; middle tier, since past cheap attempts on API-shape changes have not paid off.",
    "startedAt": "2026-10-11T03:15:00Z",
    "endedAt": "2026-10-11T03:27:00Z",
    "traceId": "0c2f577f0c2ff5b60c3093ed0c313224"
  },
  {
    "schemaVersion": 1,
    "attemptId": "run-20261011-0830:T5:2",
    "runId": "run-20261011-0830",
    "taskId": "T5",
    "taskTitle": "Idempotency keys for the charge endpoint",
    "attempt": 2,
    "size": "medium",
    "tier": "middle",
    "model": "claude-sonnet-5-5",
    "harness": "claude-code",
    "sessionId": "payments-service-46",
    "branch": "tally/run-20261011-0830/t5",
    "tokens": {
      "uncachedInput": 120000,
      "cachedInput": 1500000,
      "output": 20000,
      "total": 1640000
    },
    "estimatedCostNanos": 740000000,
    "costSource": "list-price",
    "ceilingNanos": 2000000000,
    "result": "passed",
    "resultReason": null,
    "escalatedFrom": "run-20261011-0830:T5:1",
    "handoff": "entire-handoff",
    "prUrl": "https://github.com/acme/payments-service/pull/35",
    "traceUrl": null,
    "checkpointId": "3ba366f23ba4",
    "checkpointUrl": "https://entire.io/gh/acme/payments-service/checkpoints/3ba366f23ba4",
    "decision": "Cheap attempt was stopped at its ceiling; escalating one tier with the Entire handoff summary and the saved branch, with $37.90 of budget left.",
    "startedAt": "2026-10-11T03:19:00Z",
    "endedAt": "2026-10-11T03:28:00Z",
    "traceId": "6df7ddce6df87c056df91a3c6df9b873"
  },
  {
    "schemaVersion": 1,
    "attemptId": "run-20261011-0830:T7:1",
    "runId": "run-20261011-0830",
    "taskId": "T7",
    "taskTitle": "Move ledger writes into a single transaction",
    "attempt": 1,
    "size": "large",
    "tier": "top",
    "model": "claude-opus-5-5",
    "harness": "claude-code",
    "sessionId": "payments-service-48",
    "branch": "tally/run-20261011-0830/t7",
    "tokens": {
      "uncachedInput": 420000,
      "cachedInput": 6000000,
      "output": 70000,
      "total": 6490000
    },
    "estimatedCostNanos": 4280000000,
    "costSource": "list-price",
    "ceilingNanos": 10000000000,
    "result": "passed",
    "resultReason": null,
    "escalatedFrom": null,
    "handoff": "none",
    "prUrl": "https://github.com/acme/payments-service/pull/37",
    "traceUrl": null,
    "checkpointId": "78125a547812",
    "checkpointUrl": "https://entire.io/gh/acme/payments-service/checkpoints/78125a547812",
    "decision": "Large task with 14 dependents across the ledger module and data-integrity risk; sent straight to the top tier with a $10.00 ceiling.",
    "startedAt": "2026-10-11T03:27:00Z",
    "endedAt": "2026-10-11T03:49:00Z",
    "traceId": "aa66d130aa676f67aa680d9eaa68abd5"
  }
]
