[
  {
    "schemaVersion": 1,
    "attemptId": "sample-tally-1:E1:1",
    "runId": "sample-tally-1",
    "taskId": "E1",
    "taskTitle": "First scripted task",
    "attempt": 1,
    "size": "small",
    "tier": "cheap",
    "model": "sample-model",
    "harness": "sample",
    "sessionId": null,
    "branch": null,
    "tokens": {
      "uncachedInput": 1000,
      "cachedInput": 0,
      "output": 500,
      "total": 1500
    },
    "estimatedCostNanos": 7000000000,
    "costSource": "simulated",
    "ceilingNanos": 10000000000,
    "result": "passed",
    "resultReason": null,
    "escalatedFrom": null,
    "handoff": "none",
    "prUrl": null,
    "traceId": null,
    "traceUrl": null,
    "checkpointId": null,
    "checkpointUrl": null,
    "decision": "Scripted experiment comparison; no real workers or merged PRs.",
    "startedAt": "2026-10-11T01:00:00Z",
    "endedAt": "2026-10-11T01:04:00Z"
  },
  {
    "schemaVersion": 1,
    "attemptId": "sample-tally-1:E2:1",
    "runId": "sample-tally-1",
    "taskId": "E2",
    "taskTitle": "Second scripted task",
    "attempt": 1,
    "size": "small",
    "tier": "cheap",
    "model": "sample-model",
    "harness": "sample",
    "sessionId": null,
    "branch": null,
    "tokens": {
      "uncachedInput": 1000,
      "cachedInput": 0,
      "output": 500,
      "total": 1500
    },
    "estimatedCostNanos": 7000000000,
    "costSource": "simulated",
    "ceilingNanos": 10000000000,
    "result": "failed",
    "resultReason": null,
    "escalatedFrom": null,
    "handoff": "none",
    "prUrl": null,
    "traceId": null,
    "traceUrl": null,
    "checkpointId": null,
    "checkpointUrl": null,
    "decision": "Scripted experiment comparison; no real workers or merged PRs.",
    "startedAt": "2026-10-11T01:00:00Z",
    "endedAt": "2026-10-11T01:04:00Z"
  }
]
